{
  "report_type": "duplicated_hubspot_appointments",
  "generated_at": "2025-06-27T06:27:14.521705",
  "parameters": {
    "similarity_threshold": 100,
    "total_appointments_analyzed": 1231,
    "fields_compared": [
      "appointment_date",
      "appointment_time",
      "contact_id"
    ],
    "limit_used": 5000,
    "output_limit_used": null
  },
  "summary": {
    "total_duplicate_groups_found": 592,
    "total_duplicate_groups_displayed": 592,
    "output_limited": false,
    "total_duplicate_appointments": 1231,
    "percentage_duplicates": 100.0
  },
  "duplicate_groups": [
    {
      "group_id": 1,
      "group_display_name": "Reverta Connor - 06/17/2025 10:00 PM (2 duplicates)",
      "total_duplicates": 2,
      "appointments": [
        {
          "id": "439374201439",
          "hs_appointment_start": "2025-06-17 22:00:00+00:00",
          "time": "22:00:00",
          "hs_createdate": "2025-06-25 03:01:32.221000+00:00",
          "appointment_status": "Unknown",
          "appointment_email": "7048902084@gmail.com",
          "appointment_phone": null,
          "appointment_first_name": "Reverta",
          "appointment_last_name": "Connor",
          "contact_firstname": "Reverta",
          "contact_lastname": "Connor",
          "contact_email": "7048902084@gmail.com",
          "contact_phone": "7048902084",
          "appointment_date": "2025-06-17",
          "appointment_time": "22:00:00",
          "contact_id": "129869089147"
        },
        {
          "id": "439376003907",
          "hs_appointment_start": "2025-06-17 22:00:00+00:00",
          "time": "22:00:00",
          "hs_createdate": "2025-06-25 03:01:29.504000+00:00",
          "appointment_status": "Unknown",
          "appointment_email": "7048902084@GMAIL.COM",
          "appointment_phone": null,
          "appointment_first_name": "Reberta",
          "appointment_last_name": "Connor",
          "contact_firstname": "Reverta",
          "contact_lastname": "Connor",
          "contact_email": "7048902084@gmail.com",
          "contact_phone": "7048902084",
          "appointment_date": "2025-06-17",
          "appointment_time": "22:00:00",
          "contact_id": "129869089147"
        }
      ],
      "detection_details": {
        "threshold_used": 100,
        "detection_method": "sql_exact_match",
        "appointment_date": "2025-06-17",
        "appointment_time": "22:00:00",
        "contact_id": "129869089147",
        "fields_analyzed": [
          "appointment_date",
          "appointment_time",
          "contact_id"
        ]
      }
    },
    {
      "group_id": 2,
      "group_display_name": "Joe Benge - 06/22/2025 02:00 AM (2 duplicates)",
      "total_duplicates": 2,
      "appointments": [
        {
          "id": "439382391654",
          "hs_appointment_start": "2025-06-22 02:00:00+00:00",
          "time": "02:00:00",
          "hs_createdate": "2025-06-25 03:01:31.708000+00:00",
          "appointment_status": "Unknown",
          "appointment_email": "13302839757@gmail.com",
          "appointment_phone": null,
          "appointment_first_name": "Joe",
          "appointment_last_name": "Benge",
          "contact_firstname": "Joe",
          "contact_lastname": "Benge",
          "contact_email": "13302839757@gmail.com",
          "contact_phone": "3302839757",
          "appointment_date": "2025-06-22",
          "appointment_time": "02:00:00",
          "contact_id": "130722627416"
        },
        {
          "id": "439376378177",
          "hs_appointment_start": "2025-06-22 02:00:00+00:00",
          "time": "02:00:00",
          "hs_createdate": "2025-06-25 03:01:31.688000+00:00",
          "appointment_status": "Unknown",
          "appointment_email": "13302839757@gmail.com",
          "appointment_phone": null,
          "appointment_first_name": "Joe",
          "appointment_last_name": "Benge",
          "contact_firstname": "Joe",
          "contact_lastname": "Benge",
          "contact_email": "13302839757@gmail.com",
          "contact_phone": "3302839757",
          "appointment_date": "2025-06-22",
          "appointment_time": "02:00:00",
          "contact_id": "130722627416"
        }
      ],
      "detection_details": {
        "threshold_used": 100,
        "detection_method": "sql_exact_match",
        "appointment_date": "2025-06-22",
        "appointment_time": "02:00:00",
        "contact_id": "130722627416",
        "fields_analyzed": [
          "appointment_date",
          "appointment_time",
          "contact_id"
        ]
      }
    },
    {
      "group_id": 3,
      "group_display_name": "Dorothy A Murphy - 06/11/2025 10:00 PM (2 duplicates)",
      "total_duplicates": 2,
      "appointments": [
        {
          "id": "439374792523",
          "hs_appointment_start": "2025-06-11 22:00:00+00:00",
          "time": "22:00:00",
          "hs_createdate": "2025-06-25 03:01:31.677000+00:00",
          "appointment_status": "Unknown",
          "appointment_email": "19087860022@gmail.com",
          "appointment_phone": null,
          "appointment_first_name": "Dorothy",
          "appointment_last_name": "A Murphy",
          "contact_firstname": "Dorothy",
          "contact_lastname": "A Murphy",
          "contact_email": "19087860022@gmail.com",
          "contact_phone": "+19087860022",
          "appointment_date": "2025-06-11",
          "appointment_time": "22:00:00",
          "contact_id": "129886383663"
        },
        {
          "id": "439292050024",
          "hs_appointment_start": "2025-06-11 22:00:00+00:00",
          "time": "22:00:00",
          "hs_createdate": "2025-06-24 19:03:54.481000+00:00",
          "appointment_status": "Unknown",
          "appointment_email": "19087860022@gmail.com",
          "appointment_phone": null,
          "appointment_first_name": "Dorothy",
          "appointment_last_name": "A Murphy",
          "contact_firstname": "Dorothy",
          "contact_lastname": "A Murphy",
          "contact_email": "19087860022@gmail.com",
          "contact_phone": "+19087860022",
          "appointment_date": "2025-06-11",
          "appointment_time": "22:00:00",
          "contact_id": "129886383663"
        }
      ],
      "detection_details": {
        "threshold_used": 100,
        "detection_method": "sql_exact_match",
        "appointment_date": "2025-06-11",
        "appointment_time": "22:00:00",
        "contact_id": "129886383663",
        "fields_analyzed": [
          "appointment_date",
          "appointment_time",
          "contact_id"
        ]
      }
    },
    {
      "group_id": 4,
      "group_display_name": "Joe Ondecheck - 06/21/2025 06:00 PM (2 duplicates)",
      "total_duplicates": 2,
      "appointments": [
        {
          "id": "439376283957",
          "hs_appointment_start": "2025-06-21 18:00:00+00:00",
          "time": "18:00:00",
          "hs_createdate": "2025-06-25 03:01:31.618000+00:00",
          "appointment_status": "Unknown",
          "appointment_email": "14124662325@gmail.com",
          "appointment_phone": null,
          "appointment_first_name": "Joe",
          "appointment_last_name": "Onduchek",
          "contact_firstname": "Joe",
          "contact_lastname": "Ondecheck",
          "contact_email": "4124662325@gmail.com",
          "contact_phone": "+14124662325",
          "appointment_date": "2025-06-21",
          "appointment_time": "18:00:00",
          "contact_id": "130708321375"
        },
        {
          "id": "439293773917",
          "hs_appointment_start": "2025-06-21 18:00:00+00:00",
          "time": "18:00:00",
          "hs_createdate": "2025-06-24 19:03:54.640000+00:00",
          "appointment_status": "Unknown",
          "appointment_email": "4124662325@gmail.com",
          "appointment_phone": null,
          "appointment_first_name": "Joe",
          "appointment_last_name": "Ondecheck",
          "contact_firstname": "Joe",
          "contact_lastname": "Ondecheck",
          "contact_email": "4124662325@gmail.com",
          "contact_phone": "+14124662325",
          "appointment_date": "2025-06-21",
          "appointment_time": "18:00:00",
          "contact_id": "130708321375"
        }
      ],
      "detection_details": {
        "threshold_used": 100,
        "detection_method": "sql_exact_match",
        "appointment_date": "2025-06-21",
        "appointment_time": "18:00:00",
        "contact_id": "130708321375",
        "fields_analyzed": [
          "appointment_date",
          "appointment_time",
          "contact_id"
        ]
      }
    },
    {
      "group_id": 5,
      "group_display_name": "Nate Walls - 06/21/2025 02:00 AM (2 duplicates)",
      "total_duplicates": 2,
      "appointments": [
        {
          "id": "439381200784",
          "hs_appointment_start": "2025-06-21 02:00:00+00:00",
          "time": "02:00:00",
          "hs_createdate": "2025-06-25 03:01:31.456000+00:00",
          "appointment_status": "Unknown",
          "appointment_email": "12155126231@gmail.com",
          "appointment_phone": null,
          "appointment_first_name": "Nate",
          "appointment_last_name": "Walls",
          "contact_firstname": "Nate",
          "contact_lastname": "Walls",
          "contact_email": "121551262312@gmail.com",
          "contact_phone": "2155126231",
          "appointment_date": "2025-06-21",
          "appointment_time": "02:00:00",
          "contact_id": "130717591808"
        },
        {
          "id": "439302728817",
          "hs_appointment_start": "2025-06-21 02:00:00+00:00",
          "time": "02:00:00",
          "hs_createdate": "2025-06-24 19:03:54.741000+00:00",
          "appointment_status": "Unknown",
          "appointment_email": "121551262312@gmail.com",
          "appointment_phone": null,
          "appointment_first_name": "Nate",
          "appointment_last_name": "Walls",
          "contact_firstname": "Nate",
          "contact_lastname": "Walls",
          "contact_email": "121551262312@gmail.com",
          "contact_phone": "2155126231",
          "appointment_date": "2025-06-21",
          "appointment_time": "02:00:00",
          "contact_id": "130717591808"
        }
      ],
      "detection_details": {
        "threshold_used": 100,
        "detection_method": "sql_exact_match",
        "appointment_date": "2025-06-21",
        "appointment_time": "02:00:00",
        "contact_id": "130717591808",
        "fields_analyzed": [
          "appointment_date",
          "appointment_time",
          "contact_id"
        ]
      }
    },
    {
      "group_id": 6,
      "group_display_name": "Sam Guthrie - 06/10/2025 06:00 PM (2 duplicates)",
      "total_duplicates": 2,
      "appointments": [
        {
          "id": "439380725666",
          "hs_appointment_start": "2025-06-10 18:00:00+00:00",
          "time": "18:00:00",
          "hs_createdate": "2025-06-25 03:01:31.451000+00:00",
          "appointment_status": "Unknown",
          "appointment_email": "19chevyman55@gmail.com",
          "appointment_phone": null,
          "appointment_first_name": "Sam",
          "appointment_last_name": "Guthrie",
          "contact_firstname": "Sam",
          "contact_lastname": "Guthrie",
          "contact_email": "19chevyman55@gmail.com",
          "contact_phone": "4108520659",
          "appointment_date": "2025-06-10",
          "appointment_time": "18:00:00",
          "contact_id": "128300498211"
        },
        {
          "id": "439380380810",
          "hs_appointment_start": "2025-06-10 18:00:00+00:00",
          "time": "18:00:00",
          "hs_createdate": "2025-06-25 03:01:31.232000+00:00",
          "appointment_status": "Unknown",
          "appointment_email": "19chevyman55@gmail.com",
          "appointment_phone": null,
          "appointment_first_name": "Sam",
          "appointment_last_name": "Guthrie",
          "contact_firstname": "Sam",
          "contact_lastname": "Guthrie",
          "contact_email": "19chevyman55@gmail.com",
          "contact_phone": "4108520659",
          "appointment_date": "2025-06-10",
          "appointment_time": "18:00:00",
          "contact_id": "128300498211"
        }
      ],
      "detection_details": {
        "threshold_used": 100,
        "detection_method": "sql_exact_match",
        "appointment_date": "2025-06-10",
        "appointment_time": "18:00:00",
        "contact_id": "128300498211",
        "fields_analyzed": [
          "appointment_date",
          "appointment_time",
          "contact_id"
        ]
      }
    },
    {
      "group_id": 7,
      "group_display_name": "Larrisa Ali - 06/14/2025 02:00 AM (2 duplicates)",
      "total_duplicates": 2,
      "appointments": [
        {
          "id": "439377585221",
          "hs_appointment_start": "2025-06-14 02:00:00+00:00",
          "time": "02:00:00",
          "hs_createdate": "2025-06-25 03:01:31.362000+00:00",
          "appointment_status": "Unknown",
          "appointment_email": "18144751180@gmail.com",
          "appointment_phone": null,
          "appointment_first_name": "Larrisa",
          "appointment_last_name": "Ali",
          "contact_firstname": "Larrisa",
          "contact_lastname": "Ali",
          "contact_email": "18144751180@gmail.com",
          "contact_phone": "+18144751180",
          "appointment_date": "2025-06-14",
          "appointment_time": "02:00:00",
          "contact_id": "129869088879"
        },
        {
          "id": "439307685018",
          "hs_appointment_start": "2025-06-14 02:00:00+00:00",
          "time": "02:00:00",
          "hs_createdate": "2025-06-24 19:03:54.478000+00:00",
          "appointment_status": "Unknown",
          "appointment_email": "18144751180@gmail.com",
          "appointment_phone": null,
          "appointment_first_name": "Larrisa",
          "appointment_last_name": "Ali",
          "contact_firstname": "Larrisa",
          "contact_lastname": "Ali",
          "contact_email": "18144751180@gmail.com",
          "contact_phone": "+18144751180",
          "appointment_date": "2025-06-14",
          "appointment_time": "02:00:00",
          "contact_id": "129869088879"
        }
      ],
      "detection_details": {
        "threshold_used": 100,
        "detection_method": "sql_exact_match",
        "appointment_date": "2025-06-14",
        "appointment_time": "02:00:00",
        "contact_id": "129869088879",
        "fields_analyzed": [
          "appointment_date",
          "appointment_time",
          "contact_id"
        ]
      }
    },
    {
      "group_id": 8,
      "group_display_name": "Anthony Bradley - 06/11/2025 02:00 AM (2 duplicates)",
      "total_duplicates": 2,
      "appointments": [
        {
          "id": "439366550378",
          "hs_appointment_start": "2025-06-11 02:00:00+00:00",
          "time": "02:00:00",
          "hs_createdate": "2025-06-25 03:01:31.342000+00:00",
          "appointment_status": "Unknown",
          "appointment_email": "2678443312@gmail.com",
          "appointment_phone": null,
          "appointment_first_name": "Anthony",
          "appointment_last_name": "Bradley",
          "contact_firstname": "Anthony",
          "contact_lastname": "Bradley",
          "contact_email": "2678443312@gmail.com",
          "contact_phone": "267-844-3312",
          "appointment_date": "2025-06-11",
          "appointment_time": "02:00:00",
          "contact_id": "128352595531"
        },
        {
          "id": "439373843335",
          "hs_appointment_start": "2025-06-11 02:00:00+00:00",
          "time": "02:00:00",
          "hs_createdate": "2025-06-25 03:01:30.920000+00:00",
          "appointment_status": "Unknown",
          "appointment_email": "2678443312@gmail.com",
          "appointment_phone": null,
          "appointment_first_name": "Anthony",
          "appointment_last_name": "Bradley",
          "contact_firstname": "Anthony",
          "contact_lastname": "Bradley",
          "contact_email": "2678443312@gmail.com",
          "contact_phone": "267-844-3312",
          "appointment_date": "2025-06-11",
          "appointment_time": "02:00:00",
          "contact_id": "128352595531"
        }
      ],
      "detection_details": {
        "threshold_used": 100,
        "detection_method": "sql_exact_match",
        "appointment_date": "2025-06-11",
        "appointment_time": "02:00:00",
        "contact_id": "128352595531",
        "fields_analyzed": [
          "appointment_date",
          "appointment_time",
          "contact_id"
        ]
      }
    },
    {
      "group_id": 9,
      "group_display_name": "Mary-Anne Wise - 06/11/2025 02:00 AM (2 duplicates)",
      "total_duplicates": 2,
      "appointments": [
        {
          "id": "439381392000",
          "hs_appointment_start": "2025-06-11 02:00:00+00:00",
          "time": "02:00:00",
          "hs_createdate": "2025-06-25 03:01:31.043000+00:00",
          "appointment_status": "Unknown",
          "appointment_email": "2675672323@gmail.com",
          "appointment_phone": null,
          "appointment_first_name": "Mary-Anne",
          "appointment_last_name": "Wise",
          "contact_firstname": "Mary-Anne",
          "contact_lastname": "Wise",
          "contact_email": "2675672323@gmail.com",
          "contact_phone": "267-567-2323",
          "appointment_date": "2025-06-11",
          "appointment_time": "02:00:00",
          "contact_id": "128406001316"
        },
        {
          "id": "439293773901",
          "hs_appointment_start": "2025-06-11 02:00:00+00:00",
          "time": "02:00:00",
          "hs_createdate": "2025-06-24 19:03:54.128000+00:00",
          "appointment_status": "Unknown",
          "appointment_email": "2675672323@gmail.com",
          "appointment_phone": null,
          "appointment_first_name": "Mary-Anne",
          "appointment_last_name": "Wise",
          "contact_firstname": "Mary-Anne",
          "contact_lastname": "Wise",
          "contact_email": "2675672323@gmail.com",
          "contact_phone": "267-567-2323",
          "appointment_date": "2025-06-11",
          "appointment_time": "02:00:00",
          "contact_id": "128406001316"
        }
      ],
      "detection_details": {
        "threshold_used": 100,
        "detection_method": "sql_exact_match",
        "appointment_date": "2025-06-11",
        "appointment_time": "02:00:00",
        "contact_id": "128406001316",
        "fields_analyzed": [
          "appointment_date",
          "appointment_time",
          "contact_id"
        ]
      }
    },
    {
      "group_id": 10,
      "group_display_name": "Savina Greschaw - 06/21/2025 06:00 PM (2 duplicates)",
      "total_duplicates": 2,
      "appointments": [
        {
          "id": "439381491742",
          "hs_appointment_start": "2025-06-21 18:00:00+00:00",
          "time": "18:00:00",
          "hs_createdate": "2025-06-25 03:01:30.893000+00:00",
          "appointment_status": "Unknown",
          "appointment_email": "3308317526@gmail.com",
          "appointment_phone": null,
          "appointment_first_name": "Savina",
          "appointment_last_name": "Greschaw",
          "contact_firstname": "Savina",
          "contact_lastname": "Greschaw",
          "contact_email": "3308317526@gmail.com",
          "contact_phone": "3308317526",
          "appointment_date": "2025-06-21",
          "appointment_time": "18:00:00",
          "contact_id": "130141071738"
        },
        {
          "id": "439289692328",
          "hs_appointment_start": "2025-06-21 18:00:00+00:00",
          "time": "18:00:00",
          "hs_createdate": "2025-06-24 19:03:54.716000+00:00",
          "appointment_status": "Unknown",
          "appointment_email": "savinagreschaw@gmail.com",
          "appointment_phone": null,
          "appointment_first_name": "Savina",
          "appointment_last_name": "Greschaw",
          "contact_firstname": "Savina",
          "contact_lastname": "Greschaw",
          "contact_email": "3308317526@gmail.com",
          "contact_phone": "3308317526",
          "appointment_date": "2025-06-21",
          "appointment_time": "18:00:00",
          "contact_id": "130141071738"
        }
      ],
      "detection_details": {
        "threshold_used": 100,
        "detection_method": "sql_exact_match",
        "appointment_date": "2025-06-21",
        "appointment_time": "18:00:00",
        "contact_id": "130141071738",
        "fields_analyzed": [
          "appointment_date",
          "appointment_time",
          "contact_id"
        ]
      }
    },
    {
      "group_id": 11,
      "group_display_name": "Charlie Mietezner - 06/17/2025 10:00 PM (2 duplicates)",
      "total_duplicates": 2,
      "appointments": [
        {
          "id": "439376091136",
          "hs_appointment_start": "2025-06-17 22:00:00+00:00",
          "time": "22:00:00",
          "hs_createdate": "2025-06-25 03:01:30.727000+00:00",
          "appointment_status": "Unknown",
          "appointment_email": "4123357366@gmail.com",
          "appointment_phone": null,
          "appointment_first_name": "Charlie",
          "appointment_last_name": "Mietezner",
          "contact_firstname": "Charlie",
          "contact_lastname": "Mietezner",
          "contact_email": "4123357366@gmail.com",
          "contact_phone": "4123357366",
          "appointment_date": "2025-06-17",
          "appointment_time": "22:00:00",
          "contact_id": "130141071792"
        },
        {
          "id": "439292669297",
          "hs_appointment_start": "2025-06-17 22:00:00+00:00",
          "time": "22:00:00",
          "hs_createdate": "2025-06-24 19:03:55.337000+00:00",
          "appointment_status": "Unknown",
          "appointment_email": "4123357366@gmail.com",
          "appointment_phone": null,
          "appointment_first_name": "Charlie",
          "appointment_last_name": "Mietezner",
          "contact_firstname": "Charlie",
          "contact_lastname": "Mietezner",
          "contact_email": "4123357366@gmail.com",
          "contact_phone": "4123357366",
          "appointment_date": "2025-06-17",
          "appointment_time": "22:00:00",
          "contact_id": "130141071792"
        }
      ],
      "detection_details": {
        "threshold_used": 100,
        "detection_method": "sql_exact_match",
        "appointment_date": "2025-06-17",
        "appointment_time": "22:00:00",
        "contact_id": "130141071792",
        "fields_analyzed": [
          "appointment_date",
          "appointment_time",
          "contact_id"
        ]
      }
    },
    {
      "group_id": 12,
      "group_display_name": "Donald Matthews - 06/10/2025 10:00 PM (2 duplicates)",
      "total_duplicates": 2,
      "appointments": [
        {
          "id": "439380946293",
          "hs_appointment_start": "2025-06-10 22:00:00+00:00",
          "time": "22:00:00",
          "hs_createdate": "2025-06-25 03:01:30.670000+00:00",
          "appointment_status": "Unknown",
          "appointment_email": "4127591841@gmail.com",
          "appointment_phone": null,
          "appointment_first_name": "Donald",
          "appointment_last_name": "Matthews",
          "contact_firstname": "Donald",
          "contact_lastname": "Matthews",
          "contact_email": "4127591841@gmail.com",
          "contact_phone": "724-747-6314",
          "appointment_date": "2025-06-10",
          "appointment_time": "22:00:00",
          "contact_id": "128406009757"
        },
        {
          "id": "439366550372",
          "hs_appointment_start": "2025-06-10 22:00:00+00:00",
          "time": "22:00:00",
          "hs_createdate": "2025-06-25 03:01:30.645000+00:00",
          "appointment_status": "Unknown",
          "appointment_email": "4127591841@gmail.com",
          "appointment_phone": null,
          "appointment_first_name": "Donald",
          "appointment_last_name": "Matthews",
          "contact_firstname": "Donald",
          "contact_lastname": "Matthews",
          "contact_email": "4127591841@gmail.com",
          "contact_phone": "724-747-6314",
          "appointment_date": "2025-06-10",
          "appointment_time": "22:00:00",
          "contact_id": "128406009757"
        }
      ],
      "detection_details": {
        "threshold_used": 100,
        "detection_method": "sql_exact_match",
        "appointment_date": "2025-06-10",
        "appointment_time": "22:00:00",
        "contact_id": "128406009757",
        "fields_analyzed": [
          "appointment_date",
          "appointment_time",
          "contact_id"
        ]
      }
    },
    {
      "group_id": 13,
      "group_display_name": "Mary Bohn - 06/22/2025 02:00 AM (2 duplicates)",
      "total_duplicates": 2,
      "appointments": [
        {
          "id": "439381999434",
          "hs_appointment_start": "2025-06-22 02:00:00+00:00",
          "time": "02:00:00",
          "hs_createdate": "2025-06-25 03:01:30.652000+00:00",
          "appointment_status": "Unknown",
          "appointment_email": "4403364890@gmail.com",
          "appointment_phone": null,
          "appointment_first_name": "Mary",
          "appointment_last_name": "Bohn",
          "contact_firstname": "Mary",
          "contact_lastname": "Bohn",
          "contact_email": "4403364890@gmail.com",
          "contact_phone": "4403364890",
          "appointment_date": "2025-06-22",
          "appointment_time": "02:00:00",
          "contact_id": "130766350900"
        },
        {
          "id": "439376863495",
          "hs_appointment_start": "2025-06-22 02:00:00+00:00",
          "time": "02:00:00",
          "hs_createdate": "2025-06-25 03:01:30.353000+00:00",
          "appointment_status": "Unknown",
          "appointment_email": "4403364890@gmail.com",
          "appointment_phone": null,
          "appointment_first_name": "Mary",
          "appointment_last_name": "Bohn",
          "contact_firstname": "Mary",
          "contact_lastname": "Bohn",
          "contact_email": "4403364890@gmail.com",
          "contact_phone": "4403364890",
          "appointment_date": "2025-06-22",
          "appointment_time": "02:00:00",
          "contact_id": "130766350900"
        }
      ],
      "detection_details": {
        "threshold_used": 100,
        "detection_method": "sql_exact_match",
        "appointment_date": "2025-06-22",
        "appointment_time": "02:00:00",
        "contact_id": "130766350900",
        "fields_analyzed": [
          "appointment_date",
          "appointment_time",
          "contact_id"
        ]
      }
    },
    {
      "group_id": 14,
      "group_display_name": "Donald Crabtree - 06/12/2025 02:00 AM (2 duplicates)",
      "total_duplicates": 2,
      "appointments": [
        {
          "id": "439377035176",
          "hs_appointment_start": "2025-06-12 02:00:00+00:00",
          "time": "02:00:00",
          "hs_createdate": "2025-06-25 03:01:30.645000+00:00",
          "appointment_status": "Unknown",
          "appointment_email": "4103655931@gmail.com",
          "appointment_phone": null,
          "appointment_first_name": "Donald",
          "appointment_last_name": "Crabtree",
          "contact_firstname": "Donald",
          "contact_lastname": "Crabtree",
          "contact_email": "4103655931@gmail.com",
          "contact_phone": "4103655931",
          "appointment_date": "2025-06-12",
          "appointment_time": "02:00:00",
          "contact_id": "129886383892"
        },
        {
          "id": "439375814546",
          "hs_appointment_start": "2025-06-12 02:00:00+00:00",
          "time": "02:00:00",
          "hs_createdate": "2025-06-25 03:01:30.537000+00:00",
          "appointment_status": "Unknown",
          "appointment_email": "4103655931@gmail.com",
          "appointment_phone": null,
          "appointment_first_name": "Donald",
          "appointment_last_name": "Crabtree",
          "contact_firstname": "Donald",
          "contact_lastname": "Crabtree",
          "contact_email": "4103655931@gmail.com",
          "contact_phone": "4103655931",
          "appointment_date": "2025-06-12",
          "appointment_time": "02:00:00",
          "contact_id": "129886383892"
        }
      ],
      "detection_details": {
        "threshold_used": 100,
        "detection_method": "sql_exact_match",
        "appointment_date": "2025-06-12",
        "appointment_time": "02:00:00",
        "contact_id": "129886383892",
        "fields_analyzed": [
          "appointment_date",
          "appointment_time",
          "contact_id"
        ]
      }
    },
    {
      "group_id": 15,
      "group_display_name": "Gilbert Robinson - 06/20/2025 06:00 PM (2 duplicates)",
      "total_duplicates": 2,
      "appointments": [
        {
          "id": "439381491740",
          "hs_appointment_start": "2025-06-20 18:00:00+00:00",
          "time": "18:00:00",
          "hs_createdate": "2025-06-25 03:01:30.612000+00:00",
          "appointment_status": "Unknown",
          "appointment_email": "336-409-2088@gmail.com",
          "appointment_phone": null,
          "appointment_first_name": "Gilbert",
          "appointment_last_name": "Robinson",
          "contact_firstname": "Gilbert",
          "contact_lastname": "Robinson",
          "contact_email": "336-409-2088@gmail.com",
          "contact_phone": "+13364092088",
          "appointment_date": "2025-06-20",
          "appointment_time": "18:00:00",
          "contact_id": "130729156929"
        },
        {
          "id": "439305565259",
          "hs_appointment_start": "2025-06-20 18:00:00+00:00",
          "time": "18:00:00",
          "hs_createdate": "2025-06-24 19:03:55.439000+00:00",
          "appointment_status": "Unknown",
          "appointment_email": "336-409-2088@gmail.com",
          "appointment_phone": null,
          "appointment_first_name": "Gilbert",
          "appointment_last_name": "Robinson",
          "contact_firstname": "Gilbert",
          "contact_lastname": "Robinson",
          "contact_email": "336-409-2088@gmail.com",
          "contact_phone": "+13364092088",
          "appointment_date": "2025-06-20",
          "appointment_time": "18:00:00",
          "contact_id": "130729156929"
        }
      ],
      "detection_details": {
        "threshold_used": 100,
        "detection_method": "sql_exact_match",
        "appointment_date": "2025-06-20",
        "appointment_time": "18:00:00",
        "contact_id": "130729156929",
        "fields_analyzed": [
          "appointment_date",
          "appointment_time",
          "contact_id"
        ]
      }
    },
    {
      "group_id": 16,
      "group_display_name": "Michael Finnerty - 06/20/2025 06:00 PM (2 duplicates)",
      "total_duplicates": 2,
      "appointments": [
        {
          "id": "439373650580",
          "hs_appointment_start": "2025-06-20 18:00:00+00:00",
          "time": "18:00:00",
          "hs_createdate": "2025-06-25 03:01:30.554000+00:00",
          "appointment_status": "Unknown",
          "appointment_email": "4434983819@gmail.com",
          "appointment_phone": null,
          "appointment_first_name": "Michael",
          "appointment_last_name": "Finnerty",
          "contact_firstname": "Michael",
          "contact_lastname": "Finnerty",
          "contact_email": "4434983819@gmail.com",
          "contact_phone": "+14434983819",
          "appointment_date": "2025-06-20",
          "appointment_time": "18:00:00",
          "contact_id": "130439623518"
        },
        {
          "id": "439374966887",
          "hs_appointment_start": "2025-06-20 18:00:00+00:00",
          "time": "18:00:00",
          "hs_createdate": "2025-06-25 03:01:30.267000+00:00",
          "appointment_status": "Unknown",
          "appointment_email": "4434983819@gmail.com",
          "appointment_phone": null,
          "appointment_first_name": "Michael",
          "appointment_last_name": "Finnerty",
          "contact_firstname": "Michael",
          "contact_lastname": "Finnerty",
          "contact_email": "4434983819@gmail.com",
          "contact_phone": "+14434983819",
          "appointment_date": "2025-06-20",
          "appointment_time": "18:00:00",
          "contact_id": "130439623518"
        }
      ],
      "detection_details": {
        "threshold_used": 100,
        "detection_method": "sql_exact_match",
        "appointment_date": "2025-06-20",
        "appointment_time": "18:00:00",
        "contact_id": "130439623518",
        "fields_analyzed": [
          "appointment_date",
          "appointment_time",
          "contact_id"
        ]
      }
    },
    {
      "group_id": 17,
      "group_display_name": "Gina Thackher - 06/16/2025 06:00 PM (2 duplicates)",
      "total_duplicates": 2,
      "appointments": [
        {
          "id": "439381040281",
          "hs_appointment_start": "2025-06-16 18:00:00+00:00",
          "time": "18:00:00",
          "hs_createdate": "2025-06-25 03:01:30.377000+00:00",
          "appointment_status": "Unknown",
          "appointment_email": "4404973835@gmail.com",
          "appointment_phone": null,
          "appointment_first_name": "Gina",
          "appointment_last_name": "Thackher",
          "contact_firstname": "Gina",
          "contact_lastname": "Thackher",
          "contact_email": "14404973835@gmail.com",
          "contact_phone": "14404973835",
          "appointment_date": "2025-06-16",
          "appointment_time": "18:00:00",
          "contact_id": "129056660514"
        },
        {
          "id": "439376091063",
          "hs_appointment_start": "2025-06-16 18:00:00+00:00",
          "time": "18:00:00",
          "hs_createdate": "2025-06-25 03:01:30.375000+00:00",
          "appointment_status": "Unknown",
          "appointment_email": "4404973835@gmail.com",
          "appointment_phone": null,
          "appointment_first_name": "Gina",
          "appointment_last_name": "Thackher",
          "contact_firstname": "Gina",
          "contact_lastname": "Thackher",
          "contact_email": "14404973835@gmail.com",
          "contact_phone": "14404973835",
          "appointment_date": "2025-06-16",
          "appointment_time": "18:00:00",
          "contact_id": "129056660514"
        }
      ],
      "detection_details": {
        "threshold_used": 100,
        "detection_method": "sql_exact_match",
        "appointment_date": "2025-06-16",
        "appointment_time": "18:00:00",
        "contact_id": "129056660514",
        "fields_analyzed": [
          "appointment_date",
          "appointment_time",
          "contact_id"
        ]
      }
    },
    {
      "group_id": 18,
      "group_display_name": "Kemule Lebron - 06/20/2025 10:00 PM (2 duplicates)",
      "total_duplicates": 2,
      "appointments": [
        {
          "id": "439375191193",
          "hs_appointment_start": "2025-06-20 22:00:00+00:00",
          "time": "22:00:00",
          "hs_createdate": "2025-06-25 03:01:30.271000+00:00",
          "appointment_status": "Unknown",
          "appointment_email": "4407230820@gmail.com",
          "appointment_phone": null,
          "appointment_first_name": "Kemule",
          "appointment_last_name": "Lebron",
          "contact_firstname": "Kemule",
          "contact_lastname": "Lebron",
          "contact_email": "4407230820@gmail.com",
          "contact_phone": "4407230820",
          "appointment_date": "2025-06-20",
          "appointment_time": "22:00:00",
          "contact_id": "130466941039"
        },
        {
          "id": "439299553208",
          "hs_appointment_start": "2025-06-20 22:00:00+00:00",
          "time": "22:00:00",
          "hs_createdate": "2025-06-24 19:03:54.903000+00:00",
          "appointment_status": "Unknown",
          "appointment_email": "4407230820@gmail.com",
          "appointment_phone": null,
          "appointment_first_name": "Kemule",
          "appointment_last_name": "Lebron",
          "contact_firstname": "Kemule",
          "contact_lastname": "Lebron",
          "contact_email": "4407230820@gmail.com",
          "contact_phone": "4407230820",
          "appointment_date": "2025-06-20",
          "appointment_time": "22:00:00",
          "contact_id": "130466941039"
        }
      ],
      "detection_details": {
        "threshold_used": 100,
        "detection_method": "sql_exact_match",
        "appointment_date": "2025-06-20",
        "appointment_time": "22:00:00",
        "contact_id": "130466941039",
        "fields_analyzed": [
          "appointment_date",
          "appointment_time",
          "contact_id"
        ]
      }
    },
    {
      "group_id": 19,
      "group_display_name": "Gabrielle Grasso - 06/21/2025 06:00 PM (2 duplicates)",
      "total_duplicates": 2,
      "appointments": [
        {
          "id": "439380946284",
          "hs_appointment_start": "2025-06-21 18:00:00+00:00",
          "time": "18:00:00",
          "hs_createdate": "2025-06-25 03:01:30.044000+00:00",
          "appointment_status": "Unknown",
          "appointment_email": "6092042240@gmail.com",
          "appointment_phone": null,
          "appointment_first_name": "Gabrielle",
          "appointment_last_name": "Grasso",
          "contact_firstname": "Gabrielle",
          "contact_lastname": "Grasso",
          "contact_email": "6092042240@gmail.com",
          "contact_phone": "6092042240",
          "appointment_date": "2025-06-21",
          "appointment_time": "18:00:00",
          "contact_id": "130141074800"
        },
        {
          "id": "439374465306",
          "hs_appointment_start": "2025-06-21 18:00:00+00:00",
          "time": "18:00:00",
          "hs_createdate": "2025-06-25 03:01:20.639000+00:00",
          "appointment_status": "Unknown",
          "appointment_email": "",
          "appointment_phone": null,
          "appointment_first_name": "Gabrielle",
          "appointment_last_name": "Grasso",
          "contact_firstname": "Gabrielle",
          "contact_lastname": "Grasso",
          "contact_email": "6092042240@gmail.com",
          "contact_phone": "6092042240",
          "appointment_date": "2025-06-21",
          "appointment_time": "18:00:00",
          "contact_id": "130141074800"
        }
      ],
      "detection_details": {
        "threshold_used": 100,
        "detection_method": "sql_exact_match",
        "appointment_date": "2025-06-21",
        "appointment_time": "18:00:00",
        "contact_id": "130141074800",
        "fields_analyzed": [
          "appointment_date",
          "appointment_time",
          "contact_id"
        ]
      }
    },
    {
      "group_id": 20,
      "group_display_name": "Brian Mangas - 06/19/2025 02:00 AM (2 duplicates)",
      "total_duplicates": 2,
      "appointments": [
        {
          "id": "439374201418",
          "hs_appointment_start": "2025-06-19 02:00:00+00:00",
          "time": "02:00:00",
          "hs_createdate": "2025-06-25 03:01:29.852000+00:00",
          "appointment_status": "Unknown",
          "appointment_email": "6093503647@gmail.com",
          "appointment_phone": null,
          "appointment_first_name": "Brian",
          "appointment_last_name": "Mangas",
          "contact_firstname": "Brian",
          "contact_lastname": "Mangas",
          "contact_email": "6093503647@gmail.com",
          "contact_phone": "+16093503647",
          "appointment_date": "2025-06-19",
          "appointment_time": "02:00:00",
          "contact_id": "130142385012"
        },
        {
          "id": "439289692285",
          "hs_appointment_start": "2025-06-19 02:00:00+00:00",
          "time": "02:00:00",
          "hs_createdate": "2025-06-24 19:03:54.458000+00:00",
          "appointment_status": "Unknown",
          "appointment_email": "6093503647@gmail.com",
          "appointment_phone": null,
          "appointment_first_name": "Brian",
          "appointment_last_name": "Mangas",
          "contact_firstname": "Brian",
          "contact_lastname": "Mangas",
          "contact_email": "6093503647@gmail.com",
          "contact_phone": "+16093503647",
          "appointment_date": "2025-06-19",
          "appointment_time": "02:00:00",
          "contact_id": "130142385012"
        }
      ],
      "detection_details": {
        "threshold_used": 100,
        "detection_method": "sql_exact_match",
        "appointment_date": "2025-06-19",
        "appointment_time": "02:00:00",
        "contact_id": "130142385012",
        "fields_analyzed": [
          "appointment_date",
          "appointment_time",
          "contact_id"
        ]
      }
    },
    {
      "group_id": 21,
      "group_display_name": "Doris Vollmer - 06/11/2025 10:00 PM (2 duplicates)",
      "total_duplicates": 2,
      "appointments": [
        {
          "id": "439375759881",
          "hs_appointment_start": "2025-06-11 22:00:00+00:00",
          "time": "22:00:00",
          "hs_createdate": "2025-06-25 03:01:29.635000+00:00",
          "appointment_status": "Unknown",
          "appointment_email": "614570-4301@gmail",
          "appointment_phone": null,
          "appointment_first_name": "Doris",
          "appointment_last_name": "Vollmer",
          "contact_firstname": "Doris",
          "contact_lastname": "Vollmer",
          "contact_email": "6145704301@gmail.com",
          "contact_phone": "+16145704301",
          "appointment_date": "2025-06-11",
          "appointment_time": "22:00:00",
          "contact_id": "127753326688"
        },
        {
          "id": "439304997658",
          "hs_appointment_start": "2025-06-11 22:00:00+00:00",
          "time": "22:00:00",
          "hs_createdate": "2025-06-24 19:03:54.742000+00:00",
          "appointment_status": "Unknown",
          "appointment_email": "6145704301@gmail.com",
          "appointment_phone": null,
          "appointment_first_name": "Doris",
          "appointment_last_name": "Vollmer",
          "contact_firstname": "Doris",
          "contact_lastname": "Vollmer",
          "contact_email": "6145704301@gmail.com",
          "contact_phone": "+16145704301",
          "appointment_date": "2025-06-11",
          "appointment_time": "22:00:00",
          "contact_id": "127753326688"
        }
      ],
      "detection_details": {
        "threshold_used": 100,
        "detection_method": "sql_exact_match",
        "appointment_date": "2025-06-11",
        "appointment_time": "22:00:00",
        "contact_id": "127753326688",
        "fields_analyzed": [
          "appointment_date",
          "appointment_time",
          "contact_id"
        ]
      }
    },
    {
      "group_id": 22,
      "group_display_name": "Kamil Bolkun - 06/19/2025 10:00 PM (2 duplicates)",
      "total_duplicates": 2,
      "appointments": [
        {
          "id": "439382460601",
          "hs_appointment_start": "2025-06-19 22:00:00+00:00",
          "time": "22:00:00",
          "hs_createdate": "2025-06-25 03:01:29.586000+00:00",
          "appointment_status": "Unknown",
          "appointment_email": "6319430032@GMAIL.COM",
          "appointment_phone": null,
          "appointment_first_name": "Kamil",
          "appointment_last_name": "Bolkun",
          "contact_firstname": "Kamil",
          "contact_lastname": "Bolkun",
          "contact_email": "kamilbolk@gmail.com",
          "contact_phone": "6319430032",
          "appointment_date": "2025-06-19",
          "appointment_time": "22:00:00",
          "contact_id": "129593303682"
        },
        {
          "id": "439382460518",
          "hs_appointment_start": "2025-06-19 22:00:00+00:00",
          "time": "22:00:00",
          "hs_createdate": "2025-06-25 03:01:22.846000+00:00",
          "appointment_status": "Unknown",
          "appointment_email": "kamilbolk@gmail.com",
          "appointment_phone": null,
          "appointment_first_name": "Kamil",
          "appointment_last_name": "Bolkun",
          "contact_firstname": "Kamil",
          "contact_lastname": "Bolkun",
          "contact_email": "kamilbolk@gmail.com",
          "contact_phone": "6319430032",
          "appointment_date": "2025-06-19",
          "appointment_time": "22:00:00",
          "contact_id": "129593303682"
        }
      ],
      "detection_details": {
        "threshold_used": 100,
        "detection_method": "sql_exact_match",
        "appointment_date": "2025-06-19",
        "appointment_time": "22:00:00",
        "contact_id": "129593303682",
        "fields_analyzed": [
          "appointment_date",
          "appointment_time",
          "contact_id"
        ]
      }
    },
    {
      "group_id": 23,
      "group_display_name": "Mark Rohrbaugh - 06/21/2025 02:00 AM (2 duplicates)",
      "total_duplicates": 2,
      "appointments": [
        {
          "id": "439380299383",
          "hs_appointment_start": "2025-06-21 02:00:00+00:00",
          "time": "02:00:00",
          "hs_createdate": "2025-06-25 03:01:29.540000+00:00",
          "appointment_status": "Unknown",
          "appointment_email": "7177476215@gmail.com",
          "appointment_phone": null,
          "appointment_first_name": "Mark",
          "appointment_last_name": "Rohrbaugh",
          "contact_firstname": "Mark",
          "contact_lastname": "Rohrbaugh",
          "contact_email": "7177476215@gmail.com",
          "contact_phone": "7177476215",
          "appointment_date": "2025-06-21",
          "appointment_time": "02:00:00",
          "contact_id": "130718350601"
        },
        {
          "id": "439376762694",
          "hs_appointment_start": "2025-06-21 02:00:00+00:00",
          "time": "02:00:00",
          "hs_createdate": "2025-06-25 03:01:29.325000+00:00",
          "appointment_status": "Unknown",
          "appointment_email": "7177476215@gmail.com",
          "appointment_phone": null,
          "appointment_first_name": "Mark",
          "appointment_last_name": "Rohrbaugh",
          "contact_firstname": "Mark",
          "contact_lastname": "Rohrbaugh",
          "contact_email": "7177476215@gmail.com",
          "contact_phone": "7177476215",
          "appointment_date": "2025-06-21",
          "appointment_time": "02:00:00",
          "contact_id": "130718350601"
        }
      ],
      "detection_details": {
        "threshold_used": 100,
        "detection_method": "sql_exact_match",
        "appointment_date": "2025-06-21",
        "appointment_time": "02:00:00",
        "contact_id": "130718350601",
        "fields_analyzed": [
          "appointment_date",
          "appointment_time",
          "contact_id"
        ]
      }
    },
    {
      "group_id": 24,
      "group_display_name": "Jeffrey Dukes - 06/20/2025 10:00 PM (2 duplicates)",
      "total_duplicates": 2,
      "appointments": [
        {
          "id": "439374792506",
          "hs_appointment_start": "2025-06-20 22:00:00+00:00",
          "time": "22:00:00",
          "hs_createdate": "2025-06-25 03:01:29.393000+00:00",
          "appointment_status": "Unknown",
          "appointment_email": "7177144124@gmail.com",
          "appointment_phone": null,
          "appointment_first_name": "Jeffrey",
          "appointment_last_name": "Dukes",
          "contact_firstname": "Jeffrey",
          "contact_lastname": "Dukes",
          "contact_email": "7177144124@gmail.com",
          "contact_phone": "7177144124",
          "appointment_date": "2025-06-20",
          "appointment_time": "22:00:00",
          "contact_id": "130764308290"
        },
        {
          "id": "439292669278",
          "hs_appointment_start": "2025-06-20 22:00:00+00:00",
          "time": "22:00:00",
          "hs_createdate": "2025-06-24 19:03:54.646000+00:00",
          "appointment_status": "Unknown",
          "appointment_email": "7177144124@gmail.com",
          "appointment_phone": null,
          "appointment_first_name": "Jeffrey",
          "appointment_last_name": "Dukes",
          "contact_firstname": "Jeffrey",
          "contact_lastname": "Dukes",
          "contact_email": "7177144124@gmail.com",
          "contact_phone": "7177144124",
          "appointment_date": "2025-06-20",
          "appointment_time": "22:00:00",
          "contact_id": "130764308290"
        }
      ],
      "detection_details": {
        "threshold_used": 100,
        "detection_method": "sql_exact_match",
        "appointment_date": "2025-06-20",
        "appointment_time": "22:00:00",
        "contact_id": "130764308290",
        "fields_analyzed": [
          "appointment_date",
          "appointment_time",
          "contact_id"
        ]
      }
    },
    {
      "group_id": 25,
      "group_display_name": "Mike Kerr - 06/21/2025 10:00 PM (2 duplicates)",
      "total_duplicates": 2,
      "appointments": [
        {
          "id": "439375191186",
          "hs_appointment_start": "2025-06-21 22:00:00+00:00",
          "time": "22:00:00",
          "hs_createdate": "2025-06-25 03:01:29.263000+00:00",
          "appointment_status": "Unknown",
          "appointment_email": "7243354020@gmail.com",
          "appointment_phone": null,
          "appointment_first_name": "Mike",
          "appointment_last_name": "Kerr",
          "contact_firstname": "Mike",
          "contact_lastname": "Kerr",
          "contact_email": "7243354020@gmail.com",
          "contact_phone": "7243354020",
          "appointment_date": "2025-06-21",
          "appointment_time": "22:00:00",
          "contact_id": "130709656702"
        },
        {
          "id": "439380299381",
          "hs_appointment_start": "2025-06-21 22:00:00+00:00",
          "time": "22:00:00",
          "hs_createdate": "2025-06-25 03:01:29.127000+00:00",
          "appointment_status": "Unknown",
          "appointment_email": "7243354020@gmail.com",
          "appointment_phone": null,
          "appointment_first_name": "Mike",
          "appointment_last_name": "Kerr",
          "contact_firstname": "Mike",
          "contact_lastname": "Kerr",
          "contact_email": "7243354020@gmail.com",
          "contact_phone": "7243354020",
          "appointment_date": "2025-06-21",
          "appointment_time": "22:00:00",
          "contact_id": "130709656702"
        }
      ],
      "detection_details": {
        "threshold_used": 100,
        "detection_method": "sql_exact_match",
        "appointment_date": "2025-06-21",
        "appointment_time": "22:00:00",
        "contact_id": "130709656702",
        "fields_analyzed": [
          "appointment_date",
          "appointment_time",
          "contact_id"
        ]
      }
    },
    {
      "group_id": 26,
      "group_display_name": "Amanda Ramp - 06/21/2025 02:00 AM (2 duplicates)",
      "total_duplicates": 2,
      "appointments": [
        {
          "id": "439374792504",
          "hs_appointment_start": "2025-06-21 02:00:00+00:00",
          "time": "02:00:00",
          "hs_createdate": "2025-06-25 03:01:29.263000+00:00",
          "appointment_status": "Unknown",
          "appointment_email": "7178253327@gmail.com",
          "appointment_phone": null,
          "appointment_first_name": "Amanda",
          "appointment_last_name": "Ramp",
          "contact_firstname": "Amanda",
          "contact_lastname": "Ramp",
          "contact_email": "7178253327@gmail.com",
          "contact_phone": "7178253327",
          "appointment_date": "2025-06-21",
          "appointment_time": "02:00:00",
          "contact_id": "130708712821"
        },
        {
          "id": "439381301595",
          "hs_appointment_start": "2025-06-21 02:00:00+00:00",
          "time": "02:00:00",
          "hs_createdate": "2025-06-25 03:01:29.233000+00:00",
          "appointment_status": "Unknown",
          "appointment_email": "7178253327@gmail.com",
          "appointment_phone": null,
          "appointment_first_name": "Amanda",
          "appointment_last_name": "Ramp",
          "contact_firstname": "Amanda",
          "contact_lastname": "Ramp",
          "contact_email": "7178253327@gmail.com",
          "contact_phone": "7178253327",
          "appointment_date": "2025-06-21",
          "appointment_time": "02:00:00",
          "contact_id": "130708712821"
        }
      ],
      "detection_details": {
        "threshold_used": 100,
        "detection_method": "sql_exact_match",
        "appointment_date": "2025-06-21",
        "appointment_time": "02:00:00",
        "contact_id": "130708712821",
        "fields_analyzed": [
          "appointment_date",
          "appointment_time",
          "contact_id"
        ]
      }
    },
    {
      "group_id": 27,
      "group_display_name": "Sara Gornish - 06/20/2025 02:00 AM (2 duplicates)",
      "total_duplicates": 2,
      "appointments": [
        {
          "id": "439375657013",
          "hs_appointment_start": "2025-06-20 02:00:00+00:00",
          "time": "02:00:00",
          "hs_createdate": "2025-06-25 03:01:29.262000+00:00",
          "appointment_status": "Unknown",
          "appointment_email": "7325692917@gmail.com",
          "appointment_phone": null,
          "appointment_first_name": "Sara",
          "appointment_last_name": "Gornish",
          "contact_firstname": "Sara",
          "contact_lastname": "Gornish",
          "contact_email": "7325692917@gmail.com",
          "contact_phone": "7325692917",
          "appointment_date": "2025-06-20",
          "appointment_time": "02:00:00",
          "contact_id": "130142384027"
        },
        {
          "id": "439380725608",
          "hs_appointment_start": "2025-06-20 02:00:00+00:00",
          "time": "02:00:00",
          "hs_createdate": "2025-06-25 03:01:20.461000+00:00",
          "appointment_status": "Unknown",
          "appointment_email": "",
          "appointment_phone": null,
          "appointment_first_name": "Sara",
          "appointment_last_name": "Gornish",
          "contact_firstname": "Sara",
          "contact_lastname": "Gornish",
          "contact_email": "7325692917@gmail.com",
          "contact_phone": "7325692917",
          "appointment_date": "2025-06-20",
          "appointment_time": "02:00:00",
          "contact_id": "130142384027"
        }
      ],
      "detection_details": {
        "threshold_used": 100,
        "detection_method": "sql_exact_match",
        "appointment_date": "2025-06-20",
        "appointment_time": "02:00:00",
        "contact_id": "130142384027",
        "fields_analyzed": [
          "appointment_date",
          "appointment_time",
          "contact_id"
        ]
      }
    },
    {
      "group_id": 28,
      "group_display_name": "Shaodong Jiang - 06/14/2025 06:00 PM (2 duplicates)",
      "total_duplicates": 2,
      "appointments": [
        {
          "id": "439382391636",
          "hs_appointment_start": "2025-06-14 18:00:00+00:00",
          "time": "18:00:00",
          "hs_createdate": "2025-06-25 03:01:29.229000+00:00",
          "appointment_status": "Unknown",
          "appointment_email": "7327708878@gmail.com",
          "appointment_phone": null,
          "appointment_first_name": "Shaodong",
          "appointment_last_name": "Jiang",
          "contact_firstname": "Shaodong",
          "contact_lastname": "Jiang",
          "contact_email": "17327708878@gmail.com",
          "contact_phone": "+17327708878",
          "appointment_date": "2025-06-14",
          "appointment_time": "18:00:00",
          "contact_id": "130115700585"
        },
        {
          "id": "439290246974",
          "hs_appointment_start": "2025-06-14 18:00:00+00:00",
          "time": "18:00:00",
          "hs_createdate": "2025-06-24 19:03:55.245000+00:00",
          "appointment_status": "Unknown",
          "appointment_email": "17327708878@gmail.com",
          "appointment_phone": null,
          "appointment_first_name": "Shaodong",
          "appointment_last_name": "Jiang",
          "contact_firstname": "Shaodong",
          "contact_lastname": "Jiang",
          "contact_email": "17327708878@gmail.com",
          "contact_phone": "+17327708878",
          "appointment_date": "2025-06-14",
          "appointment_time": "18:00:00",
          "contact_id": "130115700585"
        }
      ],
      "detection_details": {
        "threshold_used": 100,
        "detection_method": "sql_exact_match",
        "appointment_date": "2025-06-14",
        "appointment_time": "18:00:00",
        "contact_id": "130115700585",
        "fields_analyzed": [
          "appointment_date",
          "appointment_time",
          "contact_id"
        ]
      }
    },
    {
      "group_id": 29,
      "group_display_name": "Jennifer Rood - 06/17/2025 10:00 PM (2 duplicates)",
      "total_duplicates": 2,
      "appointments": [
        {
          "id": "439381391991",
          "hs_appointment_start": "2025-06-17 22:00:00+00:00",
          "time": "22:00:00",
          "hs_createdate": "2025-06-25 03:01:29.130000+00:00",
          "appointment_status": "Unknown",
          "appointment_email": "7246997725@gmail.com",
          "appointment_phone": null,
          "appointment_first_name": "Jennifer",
          "appointment_last_name": "Rood",
          "contact_firstname": "Jennifer",
          "contact_lastname": "Rood",
          "contact_email": "7246997725@gmail.com",
          "contact_phone": "7246997725",
          "appointment_date": "2025-06-17",
          "appointment_time": "22:00:00",
          "contact_id": "130115699222"
        },
        {
          "id": "439302728790",
          "hs_appointment_start": "2025-06-17 22:00:00+00:00",
          "time": "22:00:00",
          "hs_createdate": "2025-06-24 19:03:54.182000+00:00",
          "appointment_status": "Unknown",
          "appointment_email": "7246997725@gmail.com",
          "appointment_phone": null,
          "appointment_first_name": "Jennifer",
          "appointment_last_name": "Rood",
          "contact_firstname": "Jennifer",
          "contact_lastname": "Rood",
          "contact_email": "7246997725@gmail.com",
          "contact_phone": "7246997725",
          "appointment_date": "2025-06-17",
          "appointment_time": "22:00:00",
          "contact_id": "130115699222"
        }
      ],
      "detection_details": {
        "threshold_used": 100,
        "detection_method": "sql_exact_match",
        "appointment_date": "2025-06-17",
        "appointment_time": "22:00:00",
        "contact_id": "130115699222",
        "fields_analyzed": [
          "appointment_date",
          "appointment_time",
          "contact_id"
        ]
      }
    },
    {
      "group_id": 30,
      "group_display_name": "Rachel Pallott - 06/21/2025 10:00 PM (2 duplicates)",
      "total_duplicates": 2,
      "appointments": [
        {
          "id": "439380946279",
          "hs_appointment_start": "2025-06-21 22:00:00+00:00",
          "time": "22:00:00",
          "hs_createdate": "2025-06-25 03:01:29.103000+00:00",
          "appointment_status": "Unknown",
          "appointment_email": "7246549707@gmail.com",
          "appointment_phone": null,
          "appointment_first_name": "Rachel",
          "appointment_last_name": "Pallott",
          "contact_firstname": "Rachel",
          "contact_lastname": "Pallott",
          "contact_email": "7246549707@gmail.com",
          "contact_phone": "7246549707",
          "appointment_date": "2025-06-21",
          "appointment_time": "22:00:00",
          "contact_id": "130741649977"
        },
        {
          "id": "439370016071",
          "hs_appointment_start": "2025-06-21 22:00:00+00:00",
          "time": "22:00:00",
          "hs_createdate": "2025-06-25 03:01:29.068000+00:00",
          "appointment_status": "Unknown",
          "appointment_email": "7246549707@gmail.com",
          "appointment_phone": null,
          "appointment_first_name": "Rachel",
          "appointment_last_name": "Pallott",
          "contact_firstname": "Rachel",
          "contact_lastname": "Pallott",
          "contact_email": "7246549707@gmail.com",
          "contact_phone": "7246549707",
          "appointment_date": "2025-06-21",
          "appointment_time": "22:00:00",
          "contact_id": "130741649977"
        }
      ],
      "detection_details": {
        "threshold_used": 100,
        "detection_method": "sql_exact_match",
        "appointment_date": "2025-06-21",
        "appointment_time": "22:00:00",
        "contact_id": "130741649977",
        "fields_analyzed": [
          "appointment_date",
          "appointment_time",
          "contact_id"
        ]
      }
    },
    {
      "group_id": 31,
      "group_display_name": "Deray Jackson - 06/13/2025 06:00 PM (2 duplicates)",
      "total_duplicates": 2,
      "appointments": [
        {
          "id": "439382535515",
          "hs_appointment_start": "2025-06-13 18:00:00+00:00",
          "time": "18:00:00",
          "hs_createdate": "2025-06-25 03:01:29.081000+00:00",
          "appointment_status": "Unknown",
          "appointment_email": "7577199918@gmail.com",
          "appointment_phone": null,
          "appointment_first_name": "Deray",
          "appointment_last_name": "Jackson",
          "contact_firstname": "Deray",
          "contact_lastname": "Jackson",
          "contact_email": "7577199918@gmail.com",
          "contact_phone": "+17577199918",
          "appointment_date": "2025-06-13",
          "appointment_time": "18:00:00",
          "contact_id": "128907392837"
        },
        {
          "id": "439307685012",
          "hs_appointment_start": "2025-06-13 18:00:00+00:00",
          "time": "18:00:00",
          "hs_createdate": "2025-06-24 19:03:54.257000+00:00",
          "appointment_status": "Unknown",
          "appointment_email": "7577199918@gmail.com",
          "appointment_phone": null,
          "appointment_first_name": "Deray",
          "appointment_last_name": "Jackson",
          "contact_firstname": "Deray",
          "contact_lastname": "Jackson",
          "contact_email": "7577199918@gmail.com",
          "contact_phone": "+17577199918",
          "appointment_date": "2025-06-13",
          "appointment_time": "18:00:00",
          "contact_id": "128907392837"
        }
      ],
      "detection_details": {
        "threshold_used": 100,
        "detection_method": "sql_exact_match",
        "appointment_date": "2025-06-13",
        "appointment_time": "18:00:00",
        "contact_id": "128907392837",
        "fields_analyzed": [
          "appointment_date",
          "appointment_time",
          "contact_id"
        ]
      }
    },
    {
      "group_id": 32,
      "group_display_name": "Sharren Ross - 06/20/2025 06:00 PM (2 duplicates)",
      "total_duplicates": 2,
      "appointments": [
        {
          "id": "439381999422",
          "hs_appointment_start": "2025-06-20 18:00:00+00:00",
          "time": "18:00:00",
          "hs_createdate": "2025-06-25 03:01:29.044000+00:00",
          "appointment_status": "Unknown",
          "appointment_email": "7248823818@gmail.com",
          "appointment_phone": null,
          "appointment_first_name": "Sharren",
          "appointment_last_name": "Ross",
          "contact_firstname": "Sharren",
          "contact_lastname": "Ross",
          "contact_email": "7248823818@gmail.com",
          "contact_phone": "+17248823818",
          "appointment_date": "2025-06-20",
          "appointment_time": "18:00:00",
          "contact_id": "130717881472"
        },
        {
          "id": "439292242067",
          "hs_appointment_start": "2025-06-20 18:00:00+00:00",
          "time": "18:00:00",
          "hs_createdate": "2025-06-24 19:03:54.663000+00:00",
          "appointment_status": "Unknown",
          "appointment_email": "7248823818@gmail.com",
          "appointment_phone": null,
          "appointment_first_name": "Sharren",
          "appointment_last_name": "Ross",
          "contact_firstname": "Sharren",
          "contact_lastname": "Ross",
          "contact_email": "7248823818@gmail.com",
          "contact_phone": "+17248823818",
          "appointment_date": "2025-06-20",
          "appointment_time": "18:00:00",
          "contact_id": "130717881472"
        }
      ],
      "detection_details": {
        "threshold_used": 100,
        "detection_method": "sql_exact_match",
        "appointment_date": "2025-06-20",
        "appointment_time": "18:00:00",
        "contact_id": "130717881472",
        "fields_analyzed": [
          "appointment_date",
          "appointment_time",
          "contact_id"
        ]
      }
    },
    {
      "group_id": 33,
      "group_display_name": "Joshua Davis - 06/13/2025 06:00 PM (2 duplicates)",
      "total_duplicates": 2,
      "appointments": [
        {
          "id": "439369360198",
          "hs_appointment_start": "2025-06-13 18:00:00+00:00",
          "time": "18:00:00",
          "hs_createdate": "2025-06-25 03:01:28.938000+00:00",
          "appointment_status": "Unknown",
          "appointment_email": "8049381988@gmail.com",
          "appointment_phone": null,
          "appointment_first_name": "Joshua",
          "appointment_last_name": "Davis",
          "contact_firstname": "Joshua",
          "contact_lastname": "Davis",
          "contact_email": "8049381988@gmail.com",
          "contact_phone": "+18049381988",
          "appointment_date": "2025-06-13",
          "appointment_time": "18:00:00",
          "contact_id": "128479531361"
        },
        {
          "id": "439369256024",
          "hs_appointment_start": "2025-06-13 18:00:00+00:00",
          "time": "18:00:00",
          "hs_createdate": "2025-06-25 03:01:28.936000+00:00",
          "appointment_status": "Unknown",
          "appointment_email": "8049381988@gmail.com",
          "appointment_phone": null,
          "appointment_first_name": "Joshua",
          "appointment_last_name": "Davis",
          "contact_firstname": "Joshua",
          "contact_lastname": "Davis",
          "contact_email": "8049381988@gmail.com",
          "contact_phone": "+18049381988",
          "appointment_date": "2025-06-13",
          "appointment_time": "18:00:00",
          "contact_id": "128479531361"
        }
      ],
      "detection_details": {
        "threshold_used": 100,
        "detection_method": "sql_exact_match",
        "appointment_date": "2025-06-13",
        "appointment_time": "18:00:00",
        "contact_id": "128479531361",
        "fields_analyzed": [
          "appointment_date",
          "appointment_time",
          "contact_id"
        ]
      }
    },
    {
      "group_id": 34,
      "group_display_name": "Dan Maldet - 06/21/2025 02:00 AM (3 duplicates)",
      "total_duplicates": 3,
      "appointments": [
        {
          "id": "439375388211",
          "hs_appointment_start": "2025-06-21 02:00:00+00:00",
          "time": "02:00:00",
          "hs_createdate": "2025-06-25 03:01:28.782000+00:00",
          "appointment_status": "Unknown",
          "appointment_email": "8145212904@gmail.com",
          "appointment_phone": null,
          "appointment_first_name": "Dan",
          "appointment_last_name": "Maldet",
          "contact_firstname": "Dan",
          "contact_lastname": "Maldet",
          "contact_email": "8145212904@gmail.com",
          "contact_phone": "8145212904",
          "appointment_date": "2025-06-21",
          "appointment_time": "02:00:00",
          "contact_id": "130511631979"
        },
        {
          "id": "439375493481",
          "hs_appointment_start": "2025-06-21 02:00:00+00:00",
          "time": "02:00:00",
          "hs_createdate": "2025-06-25 03:01:28.774000+00:00",
          "appointment_status": "Unknown",
          "appointment_email": "8145212904@gmail.com",
          "appointment_phone": null,
          "appointment_first_name": "Dan",
          "appointment_last_name": "Maldet",
          "contact_firstname": "Dan",
          "contact_lastname": "Maldet",
          "contact_email": "8145212904@gmail.com",
          "contact_phone": "8145212904",
          "appointment_date": "2025-06-21",
          "appointment_time": "02:00:00",
          "contact_id": "130511631979"
        },
        {
          "id": "439377585201",
          "hs_appointment_start": "2025-06-21 02:00:00+00:00",
          "time": "02:00:00",
          "hs_createdate": "2025-06-25 03:01:28.665000+00:00",
          "appointment_status": "Unknown",
          "appointment_email": "8145212904@gmail.com",
          "appointment_phone": null,
          "appointment_first_name": "Dan",
          "appointment_last_name": "Maldet",
          "contact_firstname": "Dan",
          "contact_lastname": "Maldet",
          "contact_email": "8145212904@gmail.com",
          "contact_phone": "8145212904",
          "appointment_date": "2025-06-21",
          "appointment_time": "02:00:00",
          "contact_id": "130511631979"
        }
      ],
      "detection_details": {
        "threshold_used": 100,
        "detection_method": "sql_exact_match",
        "appointment_date": "2025-06-21",
        "appointment_time": "02:00:00",
        "contact_id": "130511631979",
        "fields_analyzed": [
          "appointment_date",
          "appointment_time",
          "contact_id"
        ]
      }
    },
    {
      "group_id": 35,
      "group_display_name": "Dominick Dipatre - 06/18/2025 02:00 AM (2 duplicates)",
      "total_duplicates": 2,
      "appointments": [
        {
          "id": "439375191185",
          "hs_appointment_start": "2025-06-18 02:00:00+00:00",
          "time": "02:00:00",
          "hs_createdate": "2025-06-25 03:01:28.782000+00:00",
          "appointment_status": "Unknown",
          "appointment_email": "80spoke@gmail.com",
          "appointment_phone": null,
          "appointment_first_name": "Dominick",
          "appointment_last_name": "Dipatre",
          "contact_firstname": "Dominick",
          "contact_lastname": "Dipatre",
          "contact_email": "80spoke@gmail.com",
          "contact_phone": "+14439456858",
          "appointment_date": "2025-06-18",
          "appointment_time": "02:00:00",
          "contact_id": "129070968463"
        },
        {
          "id": "439295188100",
          "hs_appointment_start": "2025-06-18 02:00:00+00:00",
          "time": "02:00:00",
          "hs_createdate": "2025-06-24 19:03:54.295000+00:00",
          "appointment_status": "Unknown",
          "appointment_email": "80spoke@gmail.com",
          "appointment_phone": null,
          "appointment_first_name": "Dominick",
          "appointment_last_name": "Dipatre",
          "contact_firstname": "Dominick",
          "contact_lastname": "Dipatre",
          "contact_email": "80spoke@gmail.com",
          "contact_phone": "+14439456858",
          "appointment_date": "2025-06-18",
          "appointment_time": "02:00:00",
          "contact_id": "129070968463"
        }
      ],
      "detection_details": {
        "threshold_used": 100,
        "detection_method": "sql_exact_match",
        "appointment_date": "2025-06-18",
        "appointment_time": "02:00:00",
        "contact_id": "129070968463",
        "fields_analyzed": [
          "appointment_date",
          "appointment_time",
          "contact_id"
        ]
      }
    },
    {
      "group_id": 36,
      "group_display_name": "Tom Scullion - 06/11/2025 10:00 PM (2 duplicates)",
      "total_duplicates": 2,
      "appointments": [
        {
          "id": "439376655930",
          "hs_appointment_start": "2025-06-11 22:00:00+00:00",
          "time": "22:00:00",
          "hs_createdate": "2025-06-25 03:01:28.775000+00:00",
          "appointment_status": "Unknown",
          "appointment_email": "8142418000@gmail.com",
          "appointment_phone": null,
          "appointment_first_name": "Tom",
          "appointment_last_name": "Scullion",
          "contact_firstname": "Tom",
          "contact_lastname": "Scullion",
          "contact_email": "8142418000@gmail.com",
          "contact_phone": "+18142418000",
          "appointment_date": "2025-06-11",
          "appointment_time": "22:00:00",
          "contact_id": "129869088334"
        },
        {
          "id": "439375287320",
          "hs_appointment_start": "2025-06-11 22:00:00+00:00",
          "time": "22:00:00",
          "hs_createdate": "2025-06-25 03:01:28.727000+00:00",
          "appointment_status": "Unknown",
          "appointment_email": "8142418000@gmail.com",
          "appointment_phone": null,
          "appointment_first_name": "Tom",
          "appointment_last_name": "Scullion",
          "contact_firstname": "Tom",
          "contact_lastname": "Scullion",
          "contact_email": "8142418000@gmail.com",
          "contact_phone": "+18142418000",
          "appointment_date": "2025-06-11",
          "appointment_time": "22:00:00",
          "contact_id": "129869088334"
        }
      ],
      "detection_details": {
        "threshold_used": 100,
        "detection_method": "sql_exact_match",
        "appointment_date": "2025-06-11",
        "appointment_time": "22:00:00",
        "contact_id": "129869088334",
        "fields_analyzed": [
          "appointment_date",
          "appointment_time",
          "contact_id"
        ]
      }
    },
    {
      "group_id": 37,
      "group_display_name": "Randy Williams - 06/22/2025 02:00 AM (2 duplicates)",
      "total_duplicates": 2,
      "appointments": [
        {
          "id": "439375759876",
          "hs_appointment_start": "2025-06-22 02:00:00+00:00",
          "time": "02:00:00",
          "hs_createdate": "2025-06-25 03:01:28.565000+00:00",
          "appointment_status": "Unknown",
          "appointment_email": "9802308487@gmail.com",
          "appointment_phone": null,
          "appointment_first_name": "Randy",
          "appointment_last_name": "Williams",
          "contact_firstname": "Randy",
          "contact_lastname": "Williams",
          "contact_email": "9802308487@gmail.com",
          "contact_phone": "+19802308487",
          "appointment_date": "2025-06-22",
          "appointment_time": "02:00:00",
          "contact_id": "130466182309"
        },
        {
          "id": "439375068777",
          "hs_appointment_start": "2025-06-22 02:00:00+00:00",
          "time": "02:00:00",
          "hs_createdate": "2025-06-25 03:01:28.409000+00:00",
          "appointment_status": "Unknown",
          "appointment_email": "9802308487@gmail.com",
          "appointment_phone": null,
          "appointment_first_name": "Randy",
          "appointment_last_name": "Williams",
          "contact_firstname": "Randy",
          "contact_lastname": "Williams",
          "contact_email": "9802308487@gmail.com",
          "contact_phone": "+19802308487",
          "appointment_date": "2025-06-22",
          "appointment_time": "02:00:00",
          "contact_id": "130466182309"
        }
      ],
      "detection_details": {
        "threshold_used": 100,
        "detection_method": "sql_exact_match",
        "appointment_date": "2025-06-22",
        "appointment_time": "02:00:00",
        "contact_id": "130466182309",
        "fields_analyzed": [
          "appointment_date",
          "appointment_time",
          "contact_id"
        ]
      }
    },
    {
      "group_id": 38,
      "group_display_name": "Alassane Fall - 06/15/2025 06:00 PM (2 duplicates)",
      "total_duplicates": 2,
      "appointments": [
        {
          "id": "439366550354",
          "hs_appointment_start": "2025-06-15 18:00:00+00:00",
          "time": "18:00:00",
          "hs_createdate": "2025-06-25 03:01:28.491000+00:00",
          "appointment_status": "Unknown",
          "appointment_email": "alassanef12@gmail.com",
          "appointment_phone": null,
          "appointment_first_name": "Alassane",
          "appointment_last_name": "Fall",
          "contact_firstname": "Alassane",
          "contact_lastname": "Fall",
          "contact_email": "5513585356@gmail.com",
          "contact_phone": "5513585356",
          "appointment_date": "2025-06-15",
          "appointment_time": "18:00:00",
          "contact_id": "129234535951"
        },
        {
          "id": "439376378143",
          "hs_appointment_start": "2025-06-15 18:00:00+00:00",
          "time": "18:00:00",
          "hs_createdate": "2025-06-25 03:01:28.160000+00:00",
          "appointment_status": "Unknown",
          "appointment_email": "alassanef12@gmail.com",
          "appointment_phone": null,
          "appointment_first_name": "Alassane",
          "appointment_last_name": "Fall",
          "contact_firstname": "Alassane",
          "contact_lastname": "Fall",
          "contact_email": "5513585356@gmail.com",
          "contact_phone": "5513585356",
          "appointment_date": "2025-06-15",
          "appointment_time": "18:00:00",
          "contact_id": "129234535951"
        }
      ],
      "detection_details": {
        "threshold_used": 100,
        "detection_method": "sql_exact_match",
        "appointment_date": "2025-06-15",
        "appointment_time": "18:00:00",
        "contact_id": "129234535951",
        "fields_analyzed": [
          "appointment_date",
          "appointment_time",
          "contact_id"
        ]
      }
    },
    {
      "group_id": 39,
      "group_display_name": "William Myatt - 06/20/2025 10:00 PM (2 duplicates)",
      "total_duplicates": 2,
      "appointments": [
        {
          "id": "439381301584",
          "hs_appointment_start": "2025-06-20 22:00:00+00:00",
          "time": "22:00:00",
          "hs_createdate": "2025-06-25 03:01:28.220000+00:00",
          "appointment_status": "Unknown",
          "appointment_email": "almyatt2010@gmail.com",
          "appointment_phone": null,
          "appointment_first_name": "William",
          "appointment_last_name": "Myatt",
          "contact_firstname": "William",
          "contact_lastname": "Myatt",
          "contact_email": "almyatt2010@gmail.com",
          "contact_phone": "9108902094",
          "appointment_date": "2025-06-20",
          "appointment_time": "22:00:00",
          "contact_id": "130154112693"
        },
        {
          "id": "439376478635",
          "hs_appointment_start": "2025-06-20 22:00:00+00:00",
          "time": "22:00:00",
          "hs_createdate": "2025-06-25 03:01:28.164000+00:00",
          "appointment_status": "Unknown",
          "appointment_email": "almyatt2010@gmail.com",
          "appointment_phone": null,
          "appointment_first_name": "William",
          "appointment_last_name": "Myatt",
          "contact_firstname": "William",
          "contact_lastname": "Myatt",
          "contact_email": "almyatt2010@gmail.com",
          "contact_phone": "9108902094",
          "appointment_date": "2025-06-20",
          "appointment_time": "22:00:00",
          "contact_id": "130154112693"
        }
      ],
      "detection_details": {
        "threshold_used": 100,
        "detection_method": "sql_exact_match",
        "appointment_date": "2025-06-20",
        "appointment_time": "22:00:00",
        "contact_id": "130154112693",
        "fields_analyzed": [
          "appointment_date",
          "appointment_time",
          "contact_id"
        ]
      }
    },
    {
      "group_id": 40,
      "group_display_name": "Andison Hernandez - 06/22/2025 02:00 AM (2 duplicates)",
      "total_duplicates": 2,
      "appointments": [
        {
          "id": "439377657959",
          "hs_appointment_start": "2025-06-22 02:00:00+00:00",
          "time": "02:00:00",
          "hs_createdate": "2025-06-25 03:01:28.121000+00:00",
          "appointment_status": "Unknown",
          "appointment_email": "andison@gmail.com",
          "appointment_phone": null,
          "appointment_first_name": "Andison",
          "appointment_last_name": "Hernandez",
          "contact_firstname": "Andison",
          "contact_lastname": "Hernandez",
          "contact_email": "andison@gmail.com",
          "contact_phone": "+17177140840",
          "appointment_date": "2025-06-22",
          "appointment_time": "02:00:00",
          "contact_id": "130735655848"
        },
        {
          "id": "439380946259",
          "hs_appointment_start": "2025-06-22 02:00:00+00:00",
          "time": "02:00:00",
          "hs_createdate": "2025-06-25 03:01:28.010000+00:00",
          "appointment_status": "Unknown",
          "appointment_email": "andison@gmail.com",
          "appointment_phone": null,
          "appointment_first_name": "Andison",
          "appointment_last_name": "Hernandez",
          "contact_firstname": "Andison",
          "contact_lastname": "Hernandez",
          "contact_email": "andison@gmail.com",
          "contact_phone": "+17177140840",
          "appointment_date": "2025-06-22",
          "appointment_time": "02:00:00",
          "contact_id": "130735655848"
        }
      ],
      "detection_details": {
        "threshold_used": 100,
        "detection_method": "sql_exact_match",
        "appointment_date": "2025-06-22",
        "appointment_time": "02:00:00",
        "contact_id": "130735655848",
        "fields_analyzed": [
          "appointment_date",
          "appointment_time",
          "contact_id"
        ]
      }
    },
    {
      "group_id": 41,
      "group_display_name": "Annie Thomas - 06/15/2025 02:00 AM (2 duplicates)",
      "total_duplicates": 2,
      "appointments": [
        {
          "id": "439382391632",
          "hs_appointment_start": "2025-06-15 02:00:00+00:00",
          "time": "02:00:00",
          "hs_createdate": "2025-06-25 03:01:28.006000+00:00",
          "appointment_status": "Unknown",
          "appointment_email": "anniethomas@gmail.com",
          "appointment_phone": null,
          "appointment_first_name": "Annie",
          "appointment_last_name": "Thomas",
          "contact_firstname": "Annie",
          "contact_lastname": "Thomas",
          "contact_email": "anniethomas@gmail.com",
          "contact_phone": "2345712822",
          "appointment_date": "2025-06-15",
          "appointment_time": "02:00:00",
          "contact_id": "128665379650"
        },
        {
          "id": "439380473180",
          "hs_appointment_start": "2025-06-15 02:00:00+00:00",
          "time": "02:00:00",
          "hs_createdate": "2025-06-25 03:01:27.985000+00:00",
          "appointment_status": "Unknown",
          "appointment_email": "anniethomas@gmail.com",
          "appointment_phone": null,
          "appointment_first_name": "Annie",
          "appointment_last_name": "Thomas",
          "contact_firstname": "Annie",
          "contact_lastname": "Thomas",
          "contact_email": "anniethomas@gmail.com",
          "contact_phone": "2345712822",
          "appointment_date": "2025-06-15",
          "appointment_time": "02:00:00",
          "contact_id": "128665379650"
        }
      ],
      "detection_details": {
        "threshold_used": 100,
        "detection_method": "sql_exact_match",
        "appointment_date": "2025-06-15",
        "appointment_time": "02:00:00",
        "contact_id": "128665379650",
        "fields_analyzed": [
          "appointment_date",
          "appointment_time",
          "contact_id"
        ]
      }
    },
    {
      "group_id": 42,
      "group_display_name": "Anu Puri - 06/20/2025 06:00 PM (2 duplicates)",
      "total_duplicates": 2,
      "appointments": [
        {
          "id": "439361021559",
          "hs_appointment_start": "2025-06-20 18:00:00+00:00",
          "time": "18:00:00",
          "hs_createdate": "2025-06-25 03:01:27.883000+00:00",
          "appointment_status": "Unknown",
          "appointment_email": "anupuri_us@yahoo.com",
          "appointment_phone": null,
          "appointment_first_name": "Anu",
          "appointment_last_name": "Puri",
          "contact_firstname": "Anu",
          "contact_lastname": "Puri",
          "contact_email": "anupuri_us@yahoo.com",
          "contact_phone": "3013518013",
          "appointment_date": "2025-06-20",
          "appointment_time": "18:00:00",
          "contact_id": "130610359453"
        },
        {
          "id": "438219863707",
          "hs_appointment_start": "2025-06-20 18:00:00+00:00",
          "time": "18:00:00",
          "hs_createdate": "2025-06-19 13:01:05.067000+00:00",
          "appointment_status": "Unknown",
          "appointment_email": "anupuri_us@yahoo.com",
          "appointment_phone": "+13013518013",
          "appointment_first_name": "Anu",
          "appointment_last_name": "Puri",
          "contact_firstname": "Anu",
          "contact_lastname": "Puri",
          "contact_email": "anupuri_us@yahoo.com",
          "contact_phone": "3013518013",
          "appointment_date": "2025-06-20",
          "appointment_time": "18:00:00",
          "contact_id": "130610359453"
        }
      ],
      "detection_details": {
        "threshold_used": 100,
        "detection_method": "sql_exact_match",
        "appointment_date": "2025-06-20",
        "appointment_time": "18:00:00",
        "contact_id": "130610359453",
        "fields_analyzed": [
          "appointment_date",
          "appointment_time",
          "contact_id"
        ]
      }
    },
    {
      "group_id": 43,
      "group_display_name": "John Piscal Sr - 06/16/2025 10:00 PM (4 duplicates)",
      "total_duplicates": 4,
      "appointments": [
        {
          "id": "439375133573",
          "hs_appointment_start": "2025-06-16 22:00:00+00:00",
          "time": "22:00:00",
          "hs_createdate": "2025-06-25 03:01:27.704000+00:00",
          "appointment_status": "Unknown",
          "appointment_email": "bigdaddyjwap1949@hotmail.com",
          "appointment_phone": null,
          "appointment_first_name": "John",
          "appointment_last_name": "Piscal Sr",
          "contact_firstname": "John",
          "contact_lastname": "Piscal Sr",
          "contact_email": "bigdaddyjwap1949@hotmail.com",
          "contact_phone": "6095970482",
          "appointment_date": "2025-06-16",
          "appointment_time": "22:00:00",
          "contact_id": "129255407694"
        },
        {
          "id": "439374026934",
          "hs_appointment_start": "2025-06-16 22:00:00+00:00",
          "time": "22:00:00",
          "hs_createdate": "2025-06-25 03:01:27.695000+00:00",
          "appointment_status": "Unknown",
          "appointment_email": "bigdaddyjwap1949@hotmail.com",
          "appointment_phone": null,
          "appointment_first_name": "John",
          "appointment_last_name": "Piscal Sr",
          "contact_firstname": "John",
          "contact_lastname": "Piscal Sr",
          "contact_email": "bigdaddyjwap1949@hotmail.com",
          "contact_phone": "6095970482",
          "appointment_date": "2025-06-16",
          "appointment_time": "22:00:00",
          "contact_id": "129255407694"
        },
        {
          "id": "439291943786",
          "hs_appointment_start": "2025-06-16 22:00:00+00:00",
          "time": "22:00:00",
          "hs_createdate": "2025-06-24 19:03:54.557000+00:00",
          "appointment_status": "Unknown",
          "appointment_email": "bigdaddyjwap1949@hotmail.com",
          "appointment_phone": null,
          "appointment_first_name": "John",
          "appointment_last_name": "Piscal Sr",
          "contact_firstname": "John",
          "contact_lastname": "Piscal Sr",
          "contact_email": "bigdaddyjwap1949@hotmail.com",
          "contact_phone": "6095970482",
          "appointment_date": "2025-06-16",
          "appointment_time": "22:00:00",
          "contact_id": "129255407694"
        },
        {
          "id": "439292912938",
          "hs_appointment_start": "2025-06-16 22:00:00+00:00",
          "time": "22:00:00",
          "hs_createdate": "2025-06-24 19:03:54.464000+00:00",
          "appointment_status": "Unknown",
          "appointment_email": "bigdaddyjwap1949@hotmail.com",
          "appointment_phone": null,
          "appointment_first_name": "John",
          "appointment_last_name": "Piscal Sr",
          "contact_firstname": "John",
          "contact_lastname": "Piscal Sr",
          "contact_email": "bigdaddyjwap1949@hotmail.com",
          "contact_phone": "6095970482",
          "appointment_date": "2025-06-16",
          "appointment_time": "22:00:00",
          "contact_id": "129255407694"
        }
      ],
      "detection_details": {
        "threshold_used": 100,
        "detection_method": "sql_exact_match",
        "appointment_date": "2025-06-16",
        "appointment_time": "22:00:00",
        "contact_id": "129255407694",
        "fields_analyzed": [
          "appointment_date",
          "appointment_time",
          "contact_id"
        ]
      }
    },
    {
      "group_id": 44,
      "group_display_name": "Carmen Blount - 06/12/2025 10:00 PM (2 duplicates)",
      "total_duplicates": 2,
      "appointments": [
        {
          "id": "439376967446",
          "hs_appointment_start": "2025-06-12 22:00:00+00:00",
          "time": "22:00:00",
          "hs_createdate": "2025-06-25 03:01:27.665000+00:00",
          "appointment_status": "Unknown",
          "appointment_email": "blountc445@gmail.com",
          "appointment_phone": null,
          "appointment_first_name": "Carmen",
          "appointment_last_name": "Blount",
          "contact_firstname": "Carmen",
          "contact_lastname": "Blount",
          "contact_email": "blountc445@gmail.com",
          "contact_phone": "9806356349",
          "appointment_date": "2025-06-12",
          "appointment_time": "22:00:00",
          "contact_id": "125113015143"
        },
        {
          "id": "439377585193",
          "hs_appointment_start": "2025-06-12 22:00:00+00:00",
          "time": "22:00:00",
          "hs_createdate": "2025-06-25 03:01:27.547000+00:00",
          "appointment_status": "Unknown",
          "appointment_email": "blountc445@gmail.com",
          "appointment_phone": null,
          "appointment_first_name": "Carmen",
          "appointment_last_name": "Blount",
          "contact_firstname": "Carmen",
          "contact_lastname": "Blount",
          "contact_email": "blountc445@gmail.com",
          "contact_phone": "9806356349",
          "appointment_date": "2025-06-12",
          "appointment_time": "22:00:00",
          "contact_id": "125113015143"
        }
      ],
      "detection_details": {
        "threshold_used": 100,
        "detection_method": "sql_exact_match",
        "appointment_date": "2025-06-12",
        "appointment_time": "22:00:00",
        "contact_id": "125113015143",
        "fields_analyzed": [
          "appointment_date",
          "appointment_time",
          "contact_id"
        ]
      }
    },
    {
      "group_id": 45,
      "group_display_name": "Bonnie Clark - 06/13/2025 02:00 AM (2 duplicates)",
      "total_duplicates": 2,
      "appointments": [
        {
          "id": "439374465425",
          "hs_appointment_start": "2025-06-13 02:00:00+00:00",
          "time": "02:00:00",
          "hs_createdate": "2025-06-25 03:01:27.590000+00:00",
          "appointment_status": "Unknown",
          "appointment_email": "bonniekhc3@gmail.com",
          "appointment_phone": null,
          "appointment_first_name": "Bonnie",
          "appointment_last_name": "Clark",
          "contact_firstname": "Bonnie",
          "contact_lastname": "Clark",
          "contact_email": "bonniekhc3@gmail.com",
          "contact_phone": "8506034991",
          "appointment_date": "2025-06-13",
          "appointment_time": "02:00:00",
          "contact_id": "128803187576"
        },
        {
          "id": "439292810314",
          "hs_appointment_start": "2025-06-13 02:00:00+00:00",
          "time": "02:00:00",
          "hs_createdate": "2025-06-24 19:03:54.177000+00:00",
          "appointment_status": "Unknown",
          "appointment_email": "bonniekhc3@gmail.com",
          "appointment_phone": null,
          "appointment_first_name": "Bonnie",
          "appointment_last_name": "Clark",
          "contact_firstname": "Bonnie",
          "contact_lastname": "Clark",
          "contact_email": "bonniekhc3@gmail.com",
          "contact_phone": "8506034991",
          "appointment_date": "2025-06-13",
          "appointment_time": "02:00:00",
          "contact_id": "128803187576"
        }
      ],
      "detection_details": {
        "threshold_used": 100,
        "detection_method": "sql_exact_match",
        "appointment_date": "2025-06-13",
        "appointment_time": "02:00:00",
        "contact_id": "128803187576",
        "fields_analyzed": [
          "appointment_date",
          "appointment_time",
          "contact_id"
        ]
      }
    },
    {
      "group_id": 46,
      "group_display_name": "Brent Williams - 06/16/2025 06:00 PM (2 duplicates)",
      "total_duplicates": 2,
      "appointments": [
        {
          "id": "439376378140",
          "hs_appointment_start": "2025-06-16 18:00:00+00:00",
          "time": "18:00:00",
          "hs_createdate": "2025-06-25 03:01:27.336000+00:00",
          "appointment_status": "Unknown",
          "appointment_email": "bpwimw@breezeline.net",
          "appointment_phone": null,
          "appointment_first_name": "Brent",
          "appointment_last_name": "Williams",
          "contact_firstname": "Brent",
          "contact_lastname": "Williams",
          "contact_email": "bpwimw@breezeline.net",
          "contact_phone": "+18144102387",
          "appointment_date": "2025-06-16",
          "appointment_time": "18:00:00",
          "contact_id": "129415787012"
        },
        {
          "id": "439376863401",
          "hs_appointment_start": "2025-06-16 18:00:00+00:00",
          "time": "18:00:00",
          "hs_createdate": "2025-06-25 03:01:27.242000+00:00",
          "appointment_status": "Unknown",
          "appointment_email": "bpwimw@breezeline.net",
          "appointment_phone": null,
          "appointment_first_name": "Brent",
          "appointment_last_name": "Williams",
          "contact_firstname": "Brent",
          "contact_lastname": "Williams",
          "contact_email": "bpwimw@breezeline.net",
          "contact_phone": "+18144102387",
          "appointment_date": "2025-06-16",
          "appointment_time": "18:00:00",
          "contact_id": "129415787012"
        }
      ],
      "detection_details": {
        "threshold_used": 100,
        "detection_method": "sql_exact_match",
        "appointment_date": "2025-06-16",
        "appointment_time": "18:00:00",
        "contact_id": "129415787012",
        "fields_analyzed": [
          "appointment_date",
          "appointment_time",
          "contact_id"
        ]
      }
    },
    {
      "group_id": 47,
      "group_display_name": "Brian Meenan - 06/20/2025 06:00 PM (2 duplicates)",
      "total_duplicates": 2,
      "appointments": [
        {
          "id": "439381491717",
          "hs_appointment_start": "2025-06-20 18:00:00+00:00",
          "time": "18:00:00",
          "hs_createdate": "2025-06-25 03:01:27.293000+00:00",
          "appointment_status": "Unknown",
          "appointment_email": "brianm247@yahoo.com",
          "appointment_phone": null,
          "appointment_first_name": "Brian",
          "appointment_last_name": "Meenan",
          "contact_firstname": "Brian",
          "contact_lastname": "Meenan",
          "contact_email": "brianm247@yahoo.com",
          "contact_phone": "+12023643023",
          "appointment_date": "2025-06-20",
          "appointment_time": "18:00:00",
          "contact_id": "130453405493"
        },
        {
          "id": "438122869915",
          "hs_appointment_start": "2025-06-20 18:00:00+00:00",
          "time": "18:00:00",
          "hs_createdate": "2025-06-18 23:35:20.041000+00:00",
          "appointment_status": "Unknown",
          "appointment_email": "brianm247@yahoo.com",
          "appointment_phone": "+12023643023",
          "appointment_first_name": "Brian",
          "appointment_last_name": "Meenan",
          "contact_firstname": "Brian",
          "contact_lastname": "Meenan",
          "contact_email": "brianm247@yahoo.com",
          "contact_phone": "+12023643023",
          "appointment_date": "2025-06-20",
          "appointment_time": "18:00:00",
          "contact_id": "130453405493"
        }
      ],
      "detection_details": {
        "threshold_used": 100,
        "detection_method": "sql_exact_match",
        "appointment_date": "2025-06-20",
        "appointment_time": "18:00:00",
        "contact_id": "130453405493",
        "fields_analyzed": [
          "appointment_date",
          "appointment_time",
          "contact_id"
        ]
      }
    },
    {
      "group_id": 48,
      "group_display_name": "Richard Bodine - 06/18/2025 10:00 PM (2 duplicates)",
      "total_duplicates": 2,
      "appointments": [
        {
          "id": "439375287311",
          "hs_appointment_start": "2025-06-18 22:00:00+00:00",
          "time": "22:00:00",
          "hs_createdate": "2025-06-25 03:01:27.247000+00:00",
          "appointment_status": "Unknown",
          "appointment_email": "bodine.richard@gmail.com",
          "appointment_phone": null,
          "appointment_first_name": "Richard",
          "appointment_last_name": "Bodine",
          "contact_firstname": "Richard",
          "contact_lastname": "Bodine",
          "contact_email": "bodine.richard@gmail.com",
          "contact_phone": "2402176272",
          "appointment_date": "2025-06-18",
          "appointment_time": "22:00:00",
          "contact_id": "86134871444"
        },
        {
          "id": "439294957880",
          "hs_appointment_start": "2025-06-18 22:00:00+00:00",
          "time": "22:00:00",
          "hs_createdate": "2025-06-24 19:03:54.075000+00:00",
          "appointment_status": "Unknown",
          "appointment_email": "bodine.richard@gmail.com",
          "appointment_phone": null,
          "appointment_first_name": "Richard",
          "appointment_last_name": "Bodine",
          "contact_firstname": "Richard",
          "contact_lastname": "Bodine",
          "contact_email": "bodine.richard@gmail.com",
          "contact_phone": "2402176272",
          "appointment_date": "2025-06-18",
          "appointment_time": "22:00:00",
          "contact_id": "86134871444"
        }
      ],
      "detection_details": {
        "threshold_used": 100,
        "detection_method": "sql_exact_match",
        "appointment_date": "2025-06-18",
        "appointment_time": "22:00:00",
        "contact_id": "86134871444",
        "fields_analyzed": [
          "appointment_date",
          "appointment_time",
          "contact_id"
        ]
      }
    },
    {
      "group_id": 49,
      "group_display_name": "Chris Wagner - 06/21/2025 10:00 PM (2 duplicates)",
      "total_duplicates": 2,
      "appointments": [
        {
          "id": "439377468978",
          "hs_appointment_start": "2025-06-21 22:00:00+00:00",
          "time": "22:00:00",
          "hs_createdate": "2025-06-25 03:01:26.944000+00:00",
          "appointment_status": "Unknown",
          "appointment_email": "cd3wagner@gmail.com",
          "appointment_phone": null,
          "appointment_first_name": "Chris",
          "appointment_last_name": "Wagner",
          "contact_firstname": "Chris",
          "contact_lastname": "Wagner",
          "contact_email": "cd3wagner@gmail.com",
          "contact_phone": "+15135824214",
          "appointment_date": "2025-06-21",
          "appointment_time": "22:00:00",
          "contact_id": "130722450797"
        },
        {
          "id": "439360725306",
          "hs_appointment_start": "2025-06-21 22:00:00+00:00",
